{
  "pilot_version": "0020-identity-pilot-v1",
  "slice_id": "SLICE-0020",
  "generated_at": "2026-08-24T00:00:00Z",
  "method": "Bounded, research-only identity-yield pilot. Exact/unambiguous-first overlap only: a match counts when a source-presented model name equals (case-insensitive, whitespace-normalized) an accepted SLICE-0017/0018 AUTO_ADMIT candidate's preferred_label or an already-recorded alias. No fuzzy matching, manufacturer-prefix insertion/removal, token reordering, punctuation rewriting or generation collapsing was performed. A name whose exact-match signal resolves to more than one distinct accepted identity is unresolved_possible_overlap, never forced to a single match.",
  "no_exact_overlap_signal_definition": "no_exact_overlap_signal means only that no exact/unambiguous overlap signal was found against the accepted comparison universe under this slice's exact-match rules. It does NOT mean the model identity is globally novel, safe for canonical admission, proof that no matching HullQ BoatModel exists, or permission to mint or create a canonical identity.",
  "accepted_universe": {
    "auto_admit_hullq_id_count": 1770,
    "expected_canonical_boatmodel_count": 1770,
    "manifest_paths": [
      "research/bootstrap/wikidata/manifest.json",
      "research/bootstrap/wikidata/sl0018-2500/manifest.json"
    ]
  },
  "pilot_bounds": {
    "source_count": 10,
    "per_source_cap": 20,
    "per_source_retained": 10,
    "total_cap": 200,
    "total_retained": 100
  },
  "totals": {
    "retained": 100,
    "exact_overlap": 9,
    "no_exact_overlap_signal": 91,
    "unresolved_possible_overlap": 0
  },
  "per_source": [
    {
      "source_key": "catalina_yachts",
      "source_display_name": "Catalina Yachts",
      "retained_count": 10,
      "exact_overlap_count": 5,
      "no_exact_overlap_signal_count": 5,
      "unresolved_possible_overlap_count": 0
    },
    {
      "source_key": "pearson_yachts",
      "source_display_name": "Pearson Yachts",
      "retained_count": 10,
      "exact_overlap_count": 3,
      "no_exact_overlap_signal_count": 7,
      "unresolved_possible_overlap_count": 0
    },
    {
      "source_key": "oyster_yachts",
      "source_display_name": "Oyster Yachts",
      "retained_count": 10,
      "exact_overlap_count": 0,
      "no_exact_overlap_signal_count": 10,
      "unresolved_possible_overlap_count": 0
    },
    {
      "source_key": "westerly_marine",
      "source_display_name": "Westerly Marine / Westerly Owners Association",
      "retained_count": 10,
      "exact_overlap_count": 0,
      "no_exact_overlap_signal_count": 10,
      "unresolved_possible_overlap_count": 0
    },
    {
      "source_key": "beneteau",
      "source_display_name": "Bénéteau",
      "retained_count": 10,
      "exact_overlap_count": 0,
      "no_exact_overlap_signal_count": 10,
      "unresolved_possible_overlap_count": 0
    },
    {
      "source_key": "wauquiez",
      "source_display_name": "Wauquiez",
      "retained_count": 10,
      "exact_overlap_count": 0,
      "no_exact_overlap_signal_count": 10,
      "unresolved_possible_overlap_count": 0
    },
    {
      "source_key": "elan",
      "source_display_name": "Elan",
      "retained_count": 10,
      "exact_overlap_count": 0,
      "no_exact_overlap_signal_count": 10,
      "unresolved_possible_overlap_count": 0
    },
    {
      "source_key": "cantiere_del_pardo_grand_soleil",
      "source_display_name": "Cantiere del Pardo / Grand Soleil",
      "retained_count": 10,
      "exact_overlap_count": 0,
      "no_exact_overlap_signal_count": 10,
      "unresolved_possible_overlap_count": 0
    },
    {
      "source_key": "hallberg_rassy",
      "source_display_name": "Hallberg-Rassy",
      "retained_count": 10,
      "exact_overlap_count": 1,
      "no_exact_overlap_signal_count": 9,
      "unresolved_possible_overlap_count": 0
    },
    {
      "source_key": "seawind_catamarans",
      "source_display_name": "Seawind Catamarans",
      "retained_count": 10,
      "exact_overlap_count": 0,
      "no_exact_overlap_signal_count": 10,
      "unresolved_possible_overlap_count": 0
    }
  ],
  "records": [
    {
      "source_key": "catalina_yachts",
      "source_display_name": "Catalina Yachts",
      "model_name": "Catalina 16.5",
      "source_surface": "https://www.catalinayachts.com/brochure-archives/",
      "discriminating_context": "monohull sailboat; no additional generation/variant marker beyond model number as presented",
      "classification": "exact_overlap",
      "matched_hullq_ids": [
        "BM_WDT0_333d7c0c3c6245cca203747da7da364b"
      ],
      "matched_preferred_labels": [
        "Catalina 16.5"
      ]
    },
    {
      "source_key": "catalina_yachts",
      "source_display_name": "Catalina Yachts",
      "model_name": "Catalina 18",
      "source_surface": "https://www.catalinayachts.com/brochure-archives/",
      "discriminating_context": "monohull sailboat; no additional generation/variant marker beyond model number as presented",
      "classification": "exact_overlap",
      "matched_hullq_ids": [
        "BM_WDT0_2140840f34fd4e7d8555c82ddb2e38c0"
      ],
      "matched_preferred_labels": [
        "Catalina 18"
      ]
    },
    {
      "source_key": "catalina_yachts",
      "source_display_name": "Catalina Yachts",
      "model_name": "Catalina 22 Capri",
      "source_surface": "https://www.catalinayachts.com/brochure-archives/",
      "discriminating_context": "monohull sailboat; explicit variant marker 'Capri' as presented in archive listing",
      "classification": "no_exact_overlap_signal",
      "matched_hullq_ids": [],
      "matched_preferred_labels": []
    },
    {
      "source_key": "catalina_yachts",
      "source_display_name": "Catalina Yachts",
      "model_name": "Catalina 22 Sport",
      "source_surface": "https://www.catalinayachts.com/sport-series/",
      "discriminating_context": "monohull sailboat; explicit variant marker 'Sport' as presented in archive listing",
      "classification": "no_exact_overlap_signal",
      "matched_hullq_ids": [],
      "matched_preferred_labels": []
    },
    {
      "source_key": "catalina_yachts",
      "source_display_name": "Catalina Yachts",
      "model_name": "Catalina 25",
      "source_surface": "https://www.catalinayachts.com/brochure-archives/",
      "discriminating_context": "monohull sailboat; no additional generation/variant marker beyond model number as presented",
      "classification": "exact_overlap",
      "matched_hullq_ids": [
        "BM_WDT0_d1e32c72047b4e238ce1b108315bc16f"
      ],
      "matched_preferred_labels": [
        "Catalina 25"
      ]
    },
    {
      "source_key": "catalina_yachts",
      "source_display_name": "Catalina Yachts",
      "model_name": "Catalina 27",
      "source_surface": "https://www.catalinayachts.com/brochure-archives/",
      "discriminating_context": "monohull sailboat; no additional generation/variant marker beyond model number as presented",
      "classification": "exact_overlap",
      "matched_hullq_ids": [
        "BM_WDT0_7d14ed612cb84bd28783665c8e61d71a"
      ],
      "matched_preferred_labels": [
        "Catalina 27"
      ]
    },
    {
      "source_key": "catalina_yachts",
      "source_display_name": "Catalina Yachts",
      "model_name": "Catalina 28",
      "source_surface": "https://www.catalinayachts.com/brochure-archives/",
      "discriminating_context": "monohull sailboat; no additional generation/variant marker beyond model number as presented",
      "classification": "exact_overlap",
      "matched_hullq_ids": [
        "BM_WDT0_525ab27bdfd94397914ca8806ca8822f"
      ],
      "matched_preferred_labels": [
        "Catalina 28"
      ]
    },
    {
      "source_key": "catalina_yachts",
      "source_display_name": "Catalina Yachts",
      "model_name": "Catalina 30 MKI",
      "source_surface": "https://www.catalinayachts.com/brochure-archives/",
      "discriminating_context": "monohull sailboat; explicit generation marker 'MKI' as presented in archive listing",
      "classification": "no_exact_overlap_signal",
      "matched_hullq_ids": [],
      "matched_preferred_labels": []
    },
    {
      "source_key": "catalina_yachts",
      "source_display_name": "Catalina Yachts",
      "model_name": "Catalina 320mkII",
      "source_surface": "https://www.catalinayachts.com/brochure-archives/",
      "discriminating_context": "monohull sailboat; explicit generation marker 'mkII' as presented in archive listing",
      "classification": "no_exact_overlap_signal",
      "matched_hullq_ids": [],
      "matched_preferred_labels": []
    },
    {
      "source_key": "catalina_yachts",
      "source_display_name": "Catalina Yachts",
      "model_name": "Catalina 350mkII",
      "source_surface": "https://www.catalinayachts.com/brochure-archives/",
      "discriminating_context": "monohull sailboat; explicit generation marker 'mkII' as presented in archive listing",
      "classification": "no_exact_overlap_signal",
      "matched_hullq_ids": [],
      "matched_preferred_labels": []
    },
    {
      "source_key": "pearson_yachts",
      "source_display_name": "Pearson Yachts",
      "model_name": "Pearson 26",
      "source_surface": "https://www.pearsonyachts.org/pearson-sailboats.html",
      "discriminating_context": "monohull sailboat; no additional generation/variant marker beyond model number as presented",
      "classification": "exact_overlap",
      "matched_hullq_ids": [
        "BM_WDT0_5985144d072d44a9954a8535ab014f06"
      ],
      "matched_preferred_labels": [
        "Pearson 26"
      ]
    },
    {
      "source_key": "pearson_yachts",
      "source_display_name": "Pearson Yachts",
      "model_name": "Pearson 26OD",
      "source_surface": "https://www.pearsonyachts.org/models/pearson-26od.html",
      "discriminating_context": "monohull sailboat; explicit variant marker 'OD' as presented on dedicated model page",